<?xml version="1.0" encoding="UTF-8"?>

<data xmlns:xsi="http://www.w3.org/2001/XMLSchema-instance"
xsi:noNamespaceSchemaLocation="runningexample.xsd">

	<painting>
		<name>Mona Lisa</name>
		<creator ref="1"/>
		<creationyear>around 1503/1507</creationyear>
	</painting>
	
	<building>
		<name>Empire State Building</name>
		<creator ref="3"/>
		<city>New York City</city>
		<country>USA</country>
		<part>
			<name>1st Floor</name>
			<room>
			<name>entrance hall</name>
			</room>
		</part>	
	</building>	
	
	<building>
		<name>Chrysler Building</name>
		<city>New York City</city>
		<country>Unknown</country>		
	</building>
	
	<artist id="1">
		<name>Leonardo da Vinci</name>
		<occupation>architect</occupation>
		<birthyear>1452</birthyear>
		<deathyear>1519</deathyear>
	</artist>
	
	<artist id="2">
		<name>Vincent van Gogh</name>
		<occupation>painter</occupation>
		<birthyear>1853</birthyear>
		<deathyear>1890</deathyear>
	</artist>
	

</data>